{
  "$schema": "https://json-schema.org/draft/2020-12/schema",
  "$id": "https://artifact-sdk.dev/schema/1.1/artifact/artifact.schema.json",
  "title": "Artifact",
  "type": "object",
  "required": [
    "schemaVersion",
    "id",
    "kind",
    "valueType",
    "createdBy",
    "createdAt",
    "updatedAt"
  ],
  "properties": {
    "schemaVersion": {
      "$ref": "https://artifact-sdk.dev/schema/1.1/protocol/protocol.schema.json#/$defs/schemaVersion"
    },
    "id": {
      "$ref": "https://artifact-sdk.dev/schema/1.1/protocol/protocol.schema.json#/$defs/artifactId"
    },
    "scope": {
      "$ref": "https://artifact-sdk.dev/schema/1.1/protocol/protocol.schema.json#/$defs/artifactScopeReference"
    },
    "kind": { "type": "string", "minLength": 1 },
    "valueType": {
      "$ref": "https://artifact-sdk.dev/schema/1.1/protocol/protocol.schema.json#/$defs/artifactValueType"
    },
    "title": { "type": "string" },
    "description": { "type": "string" },
    "specification": {
      "$ref": "https://artifact-sdk.dev/schema/1.1/artifact/artifact-specification.schema.json"
    },
    "currentVersionId": {
      "$ref": "https://artifact-sdk.dev/schema/1.1/protocol/protocol.schema.json#/$defs/artifactVersionId"
    },
    "createdBy": {
      "$ref": "https://artifact-sdk.dev/schema/1.1/protocol/protocol.schema.json#/$defs/actorReference"
    },
    "createdAt": {
      "$ref": "https://artifact-sdk.dev/schema/1.1/protocol/protocol.schema.json#/$defs/timestamp"
    },
    "updatedAt": {
      "$ref": "https://artifact-sdk.dev/schema/1.1/protocol/protocol.schema.json#/$defs/timestamp"
    },
    "archivedAt": {
      "$ref": "https://artifact-sdk.dev/schema/1.1/protocol/protocol.schema.json#/$defs/timestamp"
    },
    "metadata": {
      "$ref": "https://artifact-sdk.dev/schema/1.1/protocol/protocol.schema.json#/$defs/artifactMetadata"
    }
  },
  "additionalProperties": true
}
